Gene Names	Accession	Entry	Protein names	Mass
YDR470C	OG6_112510	Q03327	Mitochondrial fusion and transport protein UGO1	57543
YDR471W	OG6_101266	P0C2H7	Large ribosomal subunit protein eL27B (60S ribosomal protein L27-B)	15505
YDR472W	OG6_102532	Q03337	Trafficking protein particle complex subunit 31 (TRAPP subunit 31) (Transport protein particle 31 kDa subunit)	31722
YDR473C	OG6_102616	Q03338	U4/U6 small nuclear ribonucleoprotein PRP3 (Pre-mRNA-splicing factor 3)	55870
YDR475C	OG6_222569	Q03361	Uncharacterized protein JIP4 (Jumonji-interacting protein 4)	98691
YDR476C	OG6_500410	Q03362	Uncharacterized protein YDR476C	25266
YDR477W	OG6_100252	P06782	Carbon catabolite-derepressing protein kinase (EC 2.7.11.1) (Sucrose nonfermentating protein 1)	72045
YDR478W	OG6_500893	P40993	Ribonuclease MRP protein subunit SNM1 (RNA-processing protein SNM1) (RNase MRP 22.5 kDa subunit)	22541
YDR479C	OG6_113012	Q03370	Peroxisomal membrane protein PEX29 (Peroxin-29)	63543
YDR480W	OG6_500585	Q03373	Down-regulator of invasive growth 2 (Regulator of STE12 protein 2) (Regulator of sterile twelve 2)	36879
YDR481C	OG6_100381	P11491	Repressible alkaline phosphatase (EC 3.1.3.1) (Fructose-2,6-bisphosphate 6-phosphatase) (EC 3.1.3.54) (Membrane-bound repressible alkaline phosphatase) [Cleaved into: Soluble alkaline phosphatase (EC 3.1.7.6) (Farnesyl diphosphatase)]	63004
YDR482C	OG6_102153	Q03375	Pre-mRNA-splicing factor CWC21 (Complexed with CEF1 protein 21)	15763
YDR483W	OG6_104259	P27809	Glycolipid 2-alpha-mannosyltransferase (EC 2.4.1.-) (Alpha-1,2-mannosyltransferase)	51387
YDR484W	OG6_101848	P39904	Vacuolar protein sorting-associated protein 52 (Suppressor of actin mutation protein 2)	74333
YDR485C	OG6_500332	Q03388	Vacuolar protein sorting-associated protein 72 (SWR complex protein 2)	90580
YDR486C	OG6_102352	Q03390	Vacuolar protein-sorting-associated protein 60 (Charged multivesicular body protein 5)	25862
YDR487C	OG6_100984	Q99258	3,4-dihydroxy-2-butanone 4-phosphate synthase (DHBP synthase) (EC 4.1.99.12)	22568
YDR488C	OG6_101571	P40960	WD repeat-containing protein PAC11	60074
YDR489W	OG6_102987	Q03406	DNA replication complex GINS protein SLD5	33948
YDR490C	OG6_101713	Q03407	Serine/threonine-protein kinase PKH1 (EC 2.7.11.1) (3-phosphoinositide-dependent protein kinase 1)	86253
YDR492W	OG6_100486	Q03419	ADIPOR-like receptor IZH1 (Implicated in zinc homeostasis protein 1)	36492
YDR493W	OG6_104386	Q03429	Mitochondrial zinc maintenance protein 1, mitochondrial (Altered inheritance of mitochondria protein 8) (Found in mitochondrial proteome protein 36)	13927
YDR494W	OG6_500469	Q03430	Small ribosomal subunit protein mS46 (37S ribosomal protein RSM28, mitochondrial)	41216
YDR495C	OG6_173107	P23643	Vacuolar protein sorting-associated protein 3 (Vacuolar protein-targeting protein 17)	116922
YDR496C	OG6_102938	Q04373	Pumilio homology domain family member 6	75106
YDR497C	OG6_102726	P30605	Myo-inositol transporter 1	63570
YDR498C	OG6_500019	P28791	Protein transport protein SEC20	43882
YDR499W	OG6_500211	Q04377	DNA damage checkpoint protein LCD1 (DNA damage checkpoint protein 2) (Lethal, checkpoint-defective, DNA damage-sensitive protein 1)	86425
YDR500C	OG6_100852	P51402	Large ribosomal subunit protein eL37B (60S ribosomal protein L37-B) (L43) (YL35) (YP55)	9868
YDR501W	OG6_137859	Q04383	Protein PLM2 (Plasmid maintenance protein 2)	58202
YDR502C	OG6_100388	P19358	S-adenosylmethionine synthase 2 (AdoMet synthase 2) (EC 2.5.1.6) (Methionine adenosyltransferase 2) (MAT 2)	42256
YDR503C	OG6_100228	Q04396	Lipid phosphate phosphatase 1 (EC 3.6.1.75) (Lysophosphatidate phosphatase) (EC 3.1.3.106) (Phosphatidate phosphatase) (EC 3.1.3.4)	31586
YDR504C	OG6_500007	Q04398	Stationary phase protein 3	15580
YDR505C	OG6_104927	P50896	Protein PSP1 (Growth inhibitory protein 5) (Polymerase suppressor protein 1)	95348
YDR506C	OG6_109015	Q04399	Putative multicopper oxidase GMC1 (EC 1.-.-.-) (Grand meiotic recombination cluster protein 1)	69281
YDR507C	OG6_100252	Q12263	Serine/threonine-protein kinase GIN4 (EC 2.7.11.1) (Growth inhibitory protein 4)	129858
YDR508C	OG6_142238	P48813	High-affinity glutamine permease	73598
YDR510W	OG6_100654	Q12306	Ubiquitin-like protein SMT3	11597
YDR511W	OG6_104153	Q04401	Succinate dehydrogenase assembly factor 3, mitochondrial (SDH assembly factor 3) (SDHAF3) (Acetate non-utilizing protein 9)	15783
YDR512C	OG6_110882	Q04406	Early meiotic induction protein 1	21071
YDR513W	OG6_100315	P17695	Glutaredoxin-2 (EC 1.11.1.9) (EC 2.5.1.18) (Glutathione-dependent oxidoreductase 2) (Thioltransferase)	15861
YDR514C	OG6_117004	Q04408	Uncharacterized protein YDR514C	55490
YDR515W	OG6_500890	Q12034	Protein SLF1	50943
YDR516C	OG6_100418	Q04409	Putative glucokinase-2 (EC 2.7.1.2) (Early meiotic induction protein 2) (Glucose kinase 2) (GLK-2)	55921
YDR517W	OG6_102404	Q04410	GRASP65 homolog protein 1	41119
YDR518W	OG6_100478	P32474	Protein disulfide-isomerase EUG1 (PDI) (EC 5.3.4.1) (Endoplasmic reticulum protein EUG1)	58982
YDR519W	OG6_101705	P32472	Peptidyl-prolyl cis-trans isomerase FPR2 (PPIase FPR2) (EC 5.2.1.8) (13-kDa membrane-associated FK506-binding protein) (FKBP-13) (FK506-binding protein 2) (FKBP proline rotamase 2) (FKBP-15)	14487
YDR520C	OG6_500085	Q04411	Uracil catabolism protein 2	88648
YDR522C	OG6_117007	P08459	Sporulation-specific protein 2	55939
YDR523C	OG6_100860	P08458	Sporulation-specific protein 1 (EC 2.7.11.1)	55704
YDR524C	OG6_500170	Q04412	ADP-ribosylation factor GTPase-activating protein effector protein 1 (ARF GAP effector protein 1) (Suppressor of ARF1 thermosensitive mutant protein 1)	54494
YDR524C-B	OG6_500473	Q3E6R4	Uncharacterized protein YDR524C-B	6324
YDR524W-C	OG6_500052	P0C1Z1	Uncharacterized protein YDR524W-C	3534
YDR525W-A	OG6_499968	P56508	Protein SNA2	9180
YDR527W	OG6_104902	Q04418	RNA polymerase II-associated protein RBA50 (RNA polymerase II-associated protein of 50 kDa)	50192
YDR528W	OG6_222551	Q04429	Protein HLR1 (LRE1 homolog)	47578
YDR529C	OG6_103572	P00128	Cytochrome b-c1 complex subunit 7, mitochondrial (Complex III subunit 7) (Complex III subunit VII) (Ubiquinol-cytochrome c oxidoreductase subunit 7) (Ubiquinol-cytochrome c reductase 14 kDa protein)	14565
YDR530C	OG6_108841	P22108	Diadenosine 5',5'''-P1,P4-tetraphosphate phosphorylase 2 (Ap4A phosphorylase 2) (EC 2.7.7.53) (ADP-sulfurylase) (EC 2.7.7.5) (ATP adenylyltransferase)	36841
YDR531W	OG6_100565	Q04430	Pantothenate kinase CAB1 (EC 2.7.1.33) (Coenzyme A biosynthesis protein 1) (Pantothenic acid kinase CAB1)	40903
YDR532C	OG6_499875	Q04431	Outer kinetochore KNL1 complex subunit KRE28 (Spindle pole body component KRE28)	44675
YDR533C	OG6_105123	Q04432	Glutathione-independent glyoxalase HSP31 (EC 4.2.1.130) (Glyoxalase 3 homolog 1) (Heat shock protein 31)	25670
YDR534C	OG6_222570	Q04433	Facilitator of iron transport 1	52490
YDR536W	OG6_117943	P39932	Sugar transporter STL1	63532
YDR538W	OG6_106789	P33751	Flavin prenyltransferase PAD1, mitochondrial (EC 2.5.1.129) (Phenylacrylic acid decarboxylase 1) (PAD)	26733
YDR539W	OG6_105094	Q03034	Ferulic acid decarboxylase 1 (EC 4.1.1.102) (Phenacrylate decarboxylase)	56164
YDR540C	OG6_204921	Q03036	Uncharacterized protein IRC4 (Increased recombination centers protein 4)	21519
YDR541C	OG6_100721	Q03049	Putative uncharacterized oxidoreductase YDR541C (EC 1.1.1.-)	38586
YDR542W	OG6_109825	Q03050	Seripauperin-10	12834
YDR545W	OG6_108906	P0CX20	Y' element ATP-dependent helicase protein 1 copy 1 (EC 3.6.4.12)	203781
YEL001C	OG6_499892	P40006	Increased recombination centers protein 22	24992
YEL002C	OG6_103031	P33767	Dolichyl-diphosphooligosaccharide--protein glycosyltransferase subunit WBP1 (Oligosaccharyl transferase subunit WBP1) (Oligosaccharyl transferase subunit beta)	49392
YEL003W	OG6_102034	P40005	Prefoldin subunit 2 (Genes involved in microtubule biogenesis protein 4) (Gim complex subunit 4) (GimC subunit 4)	12994
YEL004W	OG6_104444	P40004	UDP-N-acetylglucosamine transporter YEA4	39266
YEL005C	OG6_500604	P40003	Biogenesis of lysosome-related organelles complex 1 subunit VAB2 (BLOC-1 subunit VAB2) (VAC8-binding protein 2)	31365
YEL006W	OG6_100767	P39953	Mitochondrial nicotinamide adenine dinucleotide transporter 2 (Mitochondrial NAD(+) transporter 2)	36961
YEL007W	OG6_115063	P40002	Transcriptional regulator MIT1	72534
YEL009C	OG6_143779	P03069	General control transcription factor GCN4 (Amino acid biosynthesis regulatory protein) (General control protein GCN4)	31310
YEL011W	OG6_101128	P32775	1,4-alpha-glucan-branching enzyme (EC 2.4.1.18) (Glycogen-branching enzyme)	81116
YEL012W	OG6_102420	P28263	Ubiquitin-conjugating enzyme E2-24 kDa (EC 2.3.2.23) (E2 ubiquitin-conjugating enzyme 8) (Glucose-induced degradation protein 3) (Ubiquitin carrier protein) (Ubiquitin-protein ligase)	24633
YEL013W	OG6_108710	P39968	Vacuolar protein 8	63208
YEL015W	OG6_133450	P39998	Enhancer of mRNA-decapping protein 3	61340
YEL016C	OG6_100651	P39997	Ectonucleotide pyrophosphatase/phosphodiesterase 2 (E-NPP 2) [Includes: Alkaline phosphodiesterase 1 (EC 3.1.4.1); Nucleotide pyrophosphatase (NPPase) (EC 3.6.1.9) (Nucleotide diphosphatase)]	57355
YEL017C-A	OG6_222554	P40975	Plasma membrane ATPase proteolipid 2	4848
YEL017W	OG6_500516	P39996	Glutathione transferase 3	38235
YEL018W	OG6_500192	P39995	Chromatin modification-related protein EAF5 (ESA1-associated factor 5)	31644
YEL019C	OG6_103911	P38632	E3 SUMO-protein ligase MMS21 (EC 2.3.2.-) (E3 SUMO-protein transferase MMS21) (Methyl methanesulfonate-sensitivity protein 21) (Non-structural maintenance of chromosome element 2) (Non-SMC element 2)	30354
YEL020C	OG6_100369	P39994	2-hydroxyacyl-CoA lyase (EC 4.1.2.63) (Peroxisomal protein 1)	61288
YEL020W-A	OG6_103037	O74700	Mitochondrial import inner membrane translocase subunit TIM9	10202
YEL021W	OG6_100519	P03962	Orotidine 5'-phosphate decarboxylase (EC 4.1.1.23) (OMP decarboxylase) (OMPDCase) (OMPdecase) (Uridine 5'-monophosphate synthase) (UMP synthase)	29240
YEL022W	OG6_102130	P39993	ARF guanine-nucleotide exchange factor 2	165668
YEL023C	OG6_106392	P39992	Uncharacterized protein YEL023C	78319
YEL024W	OG6_101749	P08067	Cytochrome b-c1 complex subunit Rieske, mitochondrial (EC 7.1.1.8) (Complex III subunit 5) (Rieske iron-sulfur protein) (RISP) (Ubiquinol-cytochrome c oxidoreductase iron-sulfur subunit)	23365
YEL025C	OG6_500666	P39991	Uncharacterized protein YEL025C	136069
YEL026W	OG6_101116	P39990	13 kDa ribonucleoprotein-associated protein (Small nuclear ribonucleoprotein-associated protein 1)	13569
YEL027W	OG6_100711	P25515	V-type proton ATPase subunit c (V-ATPase subunit c) (Guanine nucleotide exchange factor 2) (V-ATPase 16 kDa proteolipid subunit 1) (Vacuolar proton pump c subunit)	16351
YEL029C	OG6_102185	P39988	Putative pyridoxal kinase BUD16 (EC 2.7.1.35) (Bud site selection protein 16)	35559
YEL030W	OG6_100423	P39987	Heat shock protein SSC3, mitochondrial (Extracellular mutant protein 10)	70084
YEL031W	OG6_101914	P39986	Endoplasmic reticulum transmembrane helix translocase (EC 7.4.2.-) (Complexed with DOR1 protein 1) (Endoplasmic reticulum P5A-ATPase) (Sensitivity to the P.farinosa killer toxin protein 1)	135269
YEL032W	OG6_101598	P24279	DNA replication licensing factor MCM3 (EC 3.6.4.12) (Minichromosome maintenance protein 3)	107518
YEL033W	OG6_499971	P32633	Maintenance of telomere capping protein 7	16094
YEL034W	OG6_100628	P23301	Eukaryotic translation initiation factor 5A-1 (eIF-5A-1) (Hypusine-containing protein HP2) (eIF-4D)	17114
YEL035C	OG6_500976	P32630	Protein UTR5 (Unknown transcript 5 protein)	19335
YEL036C	OG6_129583	P32629	Mannan polymerase II complex ANP1 subunit (M-Pol II subunit ANP1) (Aminonitrophenyl propanediol resistance protein)	58182
YEL037C	OG6_101279	P32628	UV excision repair protein RAD23	42367
YEL038W	OG6_104759	P32626	Enolase-phosphatase E1 (EC 3.1.3.77) (2,3-diketo-5-methylthio-1-phosphopentane phosphatase) (Unknown transcript 4 protein)	25187
YEL039C	OG6_101063	P00045	Cytochrome c isoform 2 (Iso-2-cytochrome c) (Cytochrome c hypoxic isoform)	12532
YEL040W	OG6_107120	P32623	Probable glycosidase CRH2 (EC 3.2.-.-) (Congo red hypersensitive protein 2) (Unknown transcript 2 protein)	49906
YEL041W	OG6_100357	P32622	ATP-NADH kinase YEF1 (EC 2.7.1.86)	55874
YEL042W	OG6_101794	P32621	Guanosine-diphosphatase (GDPase) (EC 3.6.1.42)	56822
YEL043W	OG6_500193	P32618	Uncharacterized protein YEL043W	106133
YEL044W	OG6_104604	P32617	Chromatin-remodeling complex subunit IES6 (Ino eighty subunit 6)	18533
YEL046C	OG6_102336	P37303	Low specificity L-threonine aldolase (Low specificity L-TA) (TA) (EC 4.1.2.48)	42815
YEL047C	OG6_104311	P32614	Fumarate reductase 1 (FRDS1) (EC 1.3.1.6) (FAD-dependent oxidoreductase) (NADH-dependent fumarate reductase) (Soluble fumarate reductase, cytoplasmic isozyme)	50844
YEL048C	OG6_500932	P32613	TRAPP-associated protein TCA17 (17 kDa TRAPP complex-associated protein)	17354
YEL049W	OG6_109825	P32612	Seripauperin-2	12820
YEL050C	OG6_100234	P32611	Large ribosomal subunit protein uL2m (54S ribosomal protein RML2, mitochondrial) (L2)	43786
YEL051W	OG6_101069	P32610	V-type proton ATPase subunit D (V-ATPase subunit D) (Vacuolar proton pump subunit D)	29194
YEL052W	OG6_101377	P32317	Protein AFG1	58265
YEL053C	OG6_103368	Q02197	N-alpha-acetyltransferase 35, NatC auxiliary subunit (Glucose repressible protein MAK10) (L-A virus GAG protein N-acetyltransferase subunit MAK10) (Maintenance of killer protein 10) (N-terminal acetyltransferase C complex subunit MAK10) (NatC complex subunit MAK10)	84302
YEL054C	OG6_100843	P0CX53	Large ribosomal subunit protein uL11A (60S ribosomal protein L12-A) (L15) (YL23)	17823
YEL055C	OG6_104778	P39985	rDNA transcriptional regulator POL5 (EC 2.7.7.7) (DNA polymerase V) (POL V) (DNA polymerase phi)	115894
YEL056W	OG6_101102	P39984	Histone acetyltransferase type B subunit 2	45060
YEL057C	OG6_500908	P39983	Uncharacterized protein YEL057C (Suppressor of degenerative death)	27229
YEL058W	OG6_102413	P38628	Phosphoacetylglucosamine mutase (PAGM) (EC 5.4.2.3) (Acetylglucosamine phosphomutase) (N-acetylglucosamine-phosphate mutase) (PGM-complementing protein 1)	62067
YEL059C-A	OG6_500894	Q05676	Protein SOM1, mitochondrial (Mitochondrial inner membrane protease subunit SOM1)	8416
YEL060C	OG6_100121	P09232	Cerevisin (EC 3.4.21.48) (Proteinase YSCB) (Vacuolar protease B) (PrB)	69621
YEL061C	OG6_500835	P27895	Kinesin-like protein CIN8 (Chromosome instability protein 8)	113311
YEL062W	OG6_103955	P39923	Nitrogen permease regulator 2	69859
YEL063C	OG6_103579	P04817	Arginine permease CAN1 (Canavanine resistance protein 1)	65785
YEL064C	OG6_100459	P39981	Vacuolar amino acid transporter 2	53324
YEL065W	OG6_105688	P39980	Siderophore iron transporter 1 (Ferrioxamine B permease) (Siderophore iron transporter ARN3)	70562
YEL066W	OG6_132807	P39979	D-amino-acid N-acetyltransferase HPA3 (DNT) (EC 2.3.1.36)	18814
YEL067C	OG6_500260	P39978	Uncharacterized protein YEL067C	21721
YEL068C	OG6_500714	P39977	Uncharacterized protein YEL068C	12911
YEL069C	OG6_100060	P39924	Hexose transporter HXT13	62734
YEL070W	OG6_109307	P0CX08	Mannitol dehydrogenase DSF1 (EC 1.1.1.67) (Deletion suppressor of MPT5 mutation protein 1)	56470
YEL071W	OG6_100306	P39976	D-2-hydroxyglutarate--pyruvate transhydrogenase DLD3 (D-2HG--pyruvate transhydrogenase DLD3) (EC 1.1.99.40) ((R)-2-hydroxyglutarate--pyruvate transhydrogenase) (D-lactate dehydrogenase [cytochrome] 3) (EC 1.1.2.4) (D-lactate ferricytochrome C oxidoreductase) (D-LCR)	55225
YEL072W	OG6_106358	P39975	Sporulation protein RMD6 (Required for meiotic nuclear division protein 6)	26815
YEL073C	OG6_162025	P39974	Uncharacterized protein YEL073C	11960
YEL075C	OG6_108906	P39972	Uncharacterized protein YEL075C	13994
YEL076C	OG6_108906	P39971	Uncharacterized protein YEL076C	24465
YEL076C-A	OG6_108906	P0CX16	Putative uncharacterized protein YEL076C-A	24171
YEL077C	OG6_108906	Q3E7X8	Y' element ATP-dependent helicase YEL077C (EC 3.6.4.12)	143092
YER001W	OG6_105463	P39106	Alpha-1,3-mannosyltransferase MNN1 (EC 2.4.1.-)	88529
YER002W	OG6_109417	P40007	Nucleolar protein 16	26901
YER003C	OG6_102059	P29952	Mannose-6-phosphate isomerase (EC 5.3.1.8) (Phosphohexomutase) (Phosphomannose isomerase) (PMI)	48189
YER004W	OG6_103869	P40008	Protein FMP52, mitochondrial (Found in mitochondrial proteome protein 52)	25086
YER005W	OG6_101124	P40009	Golgi apyrase (EC 3.6.1.5) (ATP-diphosphatase) (ATP-diphosphohydrolase) (Adenosine diphosphatase) (ADPase) (Golgi nucleoside diphosphatase) (Yeast nucleoside diphosphatase 1)	71852
YER006W	OG6_101399	P40010	Nuclear GTP-binding protein NUG1 (Nuclear GTPase 1)	57709
YER007C-A	OG6_101211	P89886	Translation machinery-associated protein 20	20278
YER007W	OG6_102729	P39937	Protein PAC2	59258
YER008C	OG6_102748	P33332	Exocyst complex component SEC3 (Protein PSL1)	154695
YER009W	OG6_101526	P33331	Nuclear transport factor 2 (NTF-2) (Nuclear transport factor P10)	14453
YER010C	OG6_106335	P40011	4-hydroxy-4-methyl-2-oxoglutarate aldolase (HMG aldolase) (EC 4.1.3.17) (Oxaloacetate decarboxylase) (OAA decarboxylase) (EC 4.1.1.112) (Regulator of ribonuclease activity homolog) (RraA-like protein)	25563
YER011W	OG6_499871	P10863	Cold shock-induced protein TIR1 (Serine-rich protein 1) (TIP1-related protein 1)	24906
YER012W	OG6_102061	P22141	Proteasome subunit beta type-4 (Macropain subunit C11) (Multicatalytic endopeptidase complex subunit C11) (Proteasome component C11) (Proteinase YSCE subunit 11)	22517
YER013W	OG6_100085	P24384	Pre-mRNA-splicing factor ATP-dependent RNA helicase PRP22 (EC 3.6.4.13)	130011
YER014C-A	OG6_499980	P85052	Bud site selection protein 25	18006
YER014W	OG6_101704	P40012	Protoporphyrinogen oxidase (PPO) (EC 1.3.3.4)	59703
YER015W	OG6_100152	P39518	Long-chain-fatty-acid--CoA ligase 2 (EC 6.2.1.3) (Fatty acid activator 2) (Long-chain acyl-CoA synthetase 2)	83438
YER016W	OG6_100898	P40013	Protein BIM1	38362
YER017C	OG6_100384	P39925	Mitochondrial inner membrane m-AAA protease component YTA10 (EC 3.4.24.-) (EC 3.6.-.-) (ATPase family gene 3 protein) (Tat-binding homolog 10)	84544
YER018C	OG6_500618	P40014	Kinetochore protein SPC25	25244
YER019C-A	OG6_103007	P52871	Protein transport protein SBH2 (Ssh1 complex subunit SBH2) (Ssh1 complex subunit beta)	9606
YER019W	OG6_105043	P40015	Inositol phosphosphingolipids phospholipase C (IPS phospholipase C) (IPS-PLC) (EC 3.1.4.-) (Neutral sphingomyelinase) (N-SMase) (nSMase)	53940
YER020W	OG6_100285	P10823	Guanine nucleotide-binding protein alpha-2 subunit (GP2-alpha)	50448
YER021W	OG6_101680	P40016	26S proteasome regulatory subunit RPN3	60393
YER022W	OG6_137788	P32569	Mediator of RNA polymerase II transcription subunit 17 (Mediator complex subunit 17) (Suppressor of RNA polymerase B 4)	78476
YER023W	OG6_100382	P32263	Pyrroline-5-carboxylate reductase (P5C reductase) (P5CR) (EC 1.5.1.2)	30132
YER024W	OG6_500858	P40017	Carnitine O-acetyltransferase YAT2 (EC 2.3.1.7)	103334
YER025W	OG6_101121	P32481	Eukaryotic translation initiation factor 2 subunit gamma (eIF2-gamma) (EC 3.6.5.3)	57866
YER026C	OG6_106277	P08456	CDP-diacylglycerol--serine O-phosphatidyltransferase (EC 2.7.8.8) (Phosphatidylserine synthase) (PSS)	30805
YER027C	OG6_101253	Q04739	SNF1 protein kinase subunit beta-3 (Glucose repression protein GAL83) (Protein SPM1)	46648
YER028C	OG6_500950	P39943	Transcription corepressor MIG3 (Multicopy inhibitor of growth protein 3)	43119
YER029C	OG6_101868	P40018	Small nuclear ribonucleoprotein-associated protein B (snRNP-B) (Sm protein B) (Sm-B) (SmB)	22379
YER030W	OG6_500934	P40019	Histone H2A.Z-specific chaperone CHZ1	17463
YER031C	OG6_100582	P38555	GTP-binding protein YPT31/YPT8 (Rab GTPase YPT31)	24469
YER032W	OG6_500053	P40020	Factor interacting with REF2 (PAP1-interacting protein) (Polymerase-interacting protein 1)	98812
YER033C	OG6_500727	P40021	Zinc-regulated protein 8	119350
YER034W	OG6_500711	P40022	Uncharacterized protein YER034W	21191
YER035W	OG6_222571	P40023	Enhancer of mRNA-decapping protein 2	16071
YER036C	OG6_102940	P40024	ABC transporter ATP-binding protein ARB1 (EC 3.6.5.-) (ATP-binding cassette protein involved in ribosome biogenesis 1)	68377
YER037W	OG6_106165	P40025	Phosphate metabolism protein 8	37719
YER038C	OG6_500124	P40026	DNA repair protein KRE29 (Killer toxin-resistance protein 29)	53772
YER038W-A	OG6_500489	A0A023PZB3	Protein FMP49, mitochondrial (Found in mitochondrial proteome protein 49)	14348
YER039C	OG6_500071	P0CE11	Probable GDP-mannose transporter 2 (GMT 2)	27688
YER039C-A	OG6_500097	P0CD97	Uncharacterized protein YER039C-A	7986
YER040W	OG6_500963	P18494	Nitrogen regulatory protein GLN3	79383
YER041W	OG6_124905	P40028	Holliday junction resolvase YEN1 (EC 3.1.-.-)	87364
YER042W	OG6_100458	P40029	Peptide methionine sulfoxide reductase (EC 1.8.4.11) (Peptide-methionine (S)-S-oxide reductase) (Peptide Met(O) reductase) (Protein-methionine-S-oxide reductase)	21141
YER043C	OG6_100715	P39954	Adenosylhomocysteinase (AdoHcyase) (EC 3.13.2.1) (S-adenosyl-L-homocysteine hydrolase)	49126
YER044C	OG6_105162	P40030	Ergosterol biosynthetic protein 28	17135
YER044C-A	OG6_500474	P29467	Meiosis-specific protein MEI4	48215
YER045C	OG6_186922	P39970	ATF/CREB activator 1	54592
YER046W	OG6_117001	P40031	Sporulation-specific protein 73	16598
YER047C	OG6_100722	P39955	Protein SAP1 (SIN1-associated protein)	100332
YER048C	OG6_102152	P39101	Protein CAJ1	44855
YER048W-A	OG6_103491	Q6Q560	Protein ISD11 (Iron-sulfur protein biogenesis, desulfurase-interacting protein 11)	11266
YER049W	OG6_104447	P40032	Prolyl 3,4-dihydroxylase TPA1 (EC 1.14.11.-) (Termination and polyadenylation protein 1) (uS12 prolyl 3,4-dihydroxylase)	74041
YER050C	OG6_101408	P40033	Small ribosomal subunit protein bS18m (37S ribosomal protein RSM18, mitochondrial)	15835
YER051W	OG6_104082	P40034	JmjC domain-containing histone demethylation protein 1 (EC 1.14.11.27) (Jumonji/ARID domain-containing protein 1) (ScJHDM1) ([Histone-H3]-lysine-36 demethylase 1)	56530
YER052C	OG6_100697	P10869	Aspartokinase (EC 2.7.2.4) (Aspartate kinase)	58110
YER053C	OG6_101022	P40035	Mitochondrial phosphate carrier protein 2 (Phosphate transport protein 2) (PTP 2) (Pi carrier isoform 2) (mPic 2)	33528
YER053C-A	OG6_500138	Q3E7B0	Uncharacterized protein YER053C-A	4459
YER054C	OG6_222572	P40036	GLC7-interacting protein 2	62319
YER055C	OG6_103082	P00498	ATP phosphoribosyltransferase (ATP-PRT) (ATP-PRTase) (EC 2.4.2.17)	32266
YER056C	OG6_110306	P17064	Purine-cytosine permease FCY2 (PCP FCY2) (Cytosine/purine transport protein FCY2) (Fluorocytosine resistance protein 2)	58201
YER056C-A	OG6_100855	P87262	Large ribosomal subunit protein eL34A (60S ribosomal protein L34-A)	13639
YER057C	OG6_100612	P40037	Protein HMF1 (High dosage growth inhibitor) (Homologous mitochondrial matrix factor 1)	13906
YER058W	OG6_106323	Q02771	Protein PET117, mitochondrial	12281
YER059W	OG6_101636	P40038	PHO85 cyclin-6	47007
YER060W	OG6_110306	P40039	Purine-cytosine permease FCY21 (PCP FCY21) (Cytosine/purine transport protein FCY21) (Fluorocytosine resistance protein 21)	58050
YER060W-A	OG6_110306	Q12119	Purine-cytosine permease FCY22 (PCP FCY22) (Cytosine/purine transport protein FCY22) (Fluorocytosine resistance protein 22)	57327
YER061C	OG6_100752	P39525	3-oxoacyl-[acyl-carrier-protein] synthase homolog (EC 2.3.1.41) (Beta-ketoacyl-ACP synthase homolog)	47555
YER062C	OG6_111160	P40106	Glycerol-1-phosphate phosphohydrolase 2 (EC 3.1.3.21) ((DL)-glycerol-3-phosphatase 2) (Hyperosmolarity-responsive protein 2)	27814
YER063W	OG6_103733	P40040	Protein THO1	24138
YER064C	OG6_222573	P40041	Transcription factor VHR2 (VHT1 regulator 2)	56638
YER065C	OG6_104865	P28240	Isocitrate lyase (ICL) (EC 4.1.3.1) (Methylisocitrate lyase) (MICA) (EC 4.1.3.30) (Threo-D(S)-isocitrate glyoxylate-lyase)	62409
YER066W	OG6_500372	P40042	Regulator of rDNA transcription protein 13	20686
YER067W	OG6_222574	P40043	Respiratory growth induced protein 1	18989
YER068W	OG6_102042	P34909	General negative regulator of transcription subunit 4 (EC 2.3.2.27) (Modulator of transcription 2)	65354
YER069W	OG6_101994	Q01217	Protein ARG5,6, mitochondrial [Cleaved into: N-acetyl-gamma-glutamyl-phosphate reductase (EC 1.2.1.38) (N-acetyl-glutamate semialdehyde dehydrogenase) (NAGSA dehydrogenase); Acetylglutamate kinase (EC 2.7.2.8) (N-acetyl-L-glutamate 5-phosphotransferase) (NAG kinase) (AGK)]	94869
YER070W	OG6_100448	P21524	Ribonucleoside-diphosphate reductase large chain 1 (EC 1.17.4.1) (Ribonucleotide reductase R1 subunit 1) (Ribonucleotide reductase large subunit 1)	99561
YER071C	OG6_500472	P40045	Topoisomerase I damage affected protein 2	14498
YER072W	OG6_107280	P40046	Vacuolar transporter chaperone complex subunit 1 (Negative regulator of CDC42 protein 1) (Phosphate metabolism protein 4) (SPX-dependent polyphosphate polymerase VTC subunit 1) (Vacuolar membrane polyphosphate polymerase accessory subunit 1) (PolyP polymerase)	14371
YER073W	OG6_100163	P40047	Aldehyde dehydrogenase 5, mitochondrial (EC 1.2.1.-) (EC 1.2.1.4)	56693
YER074W	OG6_100698	P0CX31	Small ribosomal subunit protein eS24A (40S ribosomal protein S24-A) (RP50)	15329
YER074W-A	OG6_103811	Q3E834	Protein transport protein YOS1 (YIP one suppressor protein 1)	9436
YER075C	OG6_104767	P40048	Tyrosine-protein phosphatase 3 (EC 3.1.3.48) (Protein-tyrosine phosphatase 3) (PTPase 3)	105224
YER076C	OG6_500416	P40049	Putative uncharacterized protein YER076C	33466
YER077C	OG6_100693	P40050	MIOREX complex component 1 (Mitochondrial organization of gene expression protein 1)	79548
YER078C	OG6_100598	P40051	Intermediate cleaving peptidase 55 (EC 3.4.11.26) (Intermediate cleaving peptidase of 55 kDa)	57990
YER078W-A	OG6_500032	Q3E7A2	Uncharacterized protein YER078W-A	6263
YER079W	OG6_500533	P40052	Uncharacterized protein YER079W	23197
YER080W	OG6_110891	P40053	Altered inheritance of mitochondria protein 9, mitochondrial (Found in mitochondrial proteome protein 29)	72414
YER081W	OG6_100629	P40054	D-3-phosphoglycerate dehydrogenase 1 (3-PGDH 1) (EC 1.1.1.95) (2-oxoglutarate reductase) (EC 1.1.1.399)	51193
